{
  "schemaVersion": 1,
  "id": "protege-fund-services",
  "name": "Protege Fund Services",
  "type": "other",
  "status": "active",
  "website": "https://protegefs.com",
  "sources": [
    {
      "title": "Protege Fund Services official website",
      "url": "https://protegefs.com",
      "accessedAt": "2026-10-01"
    }
  ]
}
