{
  "schemaVersion": 1,
  "id": "securitize-hamilton-lane-scope-feeder",
  "name": "Securitize Hamilton Lane SCOPE Feeder",
  "legalName": "Securitize Feeder - Hamilton Lane Senior Credit Opportunities Fund",
  "type": "special-purpose-vehicle",
  "jurisdiction": "US",
  "status": "active",
  "website": "https://securitize.io",
  "sources": [
    {
      "title": "Securitize Hamilton Lane SCOPE Feeder official website",
      "url": "https://securitize.io",
      "accessedAt": "2026-10-01"
    }
  ]
}
